{
  "schema_version": "repo03.gnss.scenario.v1",
  "scenario_id": "gnss-missing-module",
  "engine_id": "repo03-gnss-validator",
  "module_id": "gnss",
  "variant_id": "A",
  "enabled_modules": ["can", "lin", "gnss"],
  "variant_contract": {"schema_version": "repo03.variant.schema.v1", "profile_hash": "f74c42bb2a2519ab563a91cb05cfb6d4e5accd9d6f2570ed89604bbad5e0367e", "source": {"classification": "SOURCE_EXPLICIT", "reference": "variants/fixtures/valid_variant_a.json", "version": "D1-2026-10-17"}},
  "source": {"classification": "ENGINEERING_RULE", "reference": "REP-03/WF-03-04/missing-module", "version": "1.0.0"},
  "synthetic_data": true,
  "known_gaps": ["GAP-02"],
  "module_profile": null,
  "freshness_policy": {"max_age_ms": 1000, "source": {"classification": "ENGINEERING_RULE", "reference": "REP-03/WF-03-04/synthetic-freshness-threshold", "version": "1.0.0"}},
  "observation": {
    "fix_quality": "FIX_3D",
    "timestamp_ms": 100000,
    "previous_timestamp_ms": 99000,
    "evaluation_timestamp_ms": 100200,
    "age_ms": 200,
    "antenna_status": "NOMINAL",
    "position": {"latitude_deg": 41.0082, "longitude_deg": 28.9784, "altitude_m": 42.0, "synthetic_data": true},
    "source": {"classification": "ENGINEERING_RULE", "reference": "REP-03/WF-03-04/synthetic-missing-module", "version": "1.0.0"}
  }
}
